,id,attester,recipient,timeCreated,contributionRegUID,projectRegUID,farcasterID,issuer,metadataurl,metadata,status
321,0xa14c05d91eb9eeb536baab938db5613a9e0fe59b7bccd615adc9c34ed422ce5a,0x7484aABFef9f39464F332e632047983b67571C0a,0x07Fda67513EC0897866098a11dC3858089D4A505,2024-10-17 20:15:02,0xbe6777eb0f4b0a3028a889d55ff0e62402e4e5e77c197648c673f25380e076ca,0x6b68c75e9dcd10c64f2b440e47589eb9ef29e17352055816e4f974401eab2358,18391,MGL,https://gateway.pinata.cloud/ipfs/QmZdZ6jnB63y7sHCAnxACwbUPy7uYipztdeKzjueutFG1f,"{'id': 2030, 'project': {'name': 'Curia OP Governance Analytics Dashboard', 'description': ""We are the team behind the Curia OP Governance Analytics Dashboard, a comprehensive tool designed to empower the Optimism Collective through transparency and data-driven insights. Our dashboard provides essential governance metrics such as participation rates, voting power distribution, delegates' performance, and voting history. By continuously refining our features based on community feedback, we've enriched stakeholder engagement and informed decision-making processes.\n\nSince last year, we've introduced significant enhancements to the dashboard, including:\n\nCitizen House Integration: We now provide comprehensive data visualization tools for the Citizen House, focusing on Badgeholder analytics and veto proposals. This update enables a clearer understanding of activities within the Citizen House and enhances transparency around proposal results and participation.\n\nRetroPGF Project Analytics: Our dashboard now offers detailed tracking and insights into RetroPGF projects, including an Application Funnel Overview that displays the entire project application process, from submission to decision. We also provide analytics on ongoing and upcoming RetroPGF projects, including RetroPGF 3 & 4, ensuring that the community can better understand and monitor project dynamics and impact.\n\nUI and User Experience Improvements: We revamped the user interface, enhancing the visibility of delegate voting power and improving the navigation bar for easier interaction. Our new delegate card feature allows for more detailed and interactive insights, making it easier for users to track individual delegate activity.\n\nPartial Delegation Integration: We introduced detailed insights into the sources of a delegate's voting power, distinguishing between partial and full delegations. This feature provides a more granular view of each delegate’s influence within the governance process.\n\nDelegate Ranking Bump Chart: A dynamic tool that visualizes the evolution of delegates’ voting power over various timeframes, offering a detailed view of ranking changes to better understand the governance dynamics.\n\nThrough these updates, the Curia OP Governance Analytics Dashboard has continued to foster a culture of accountability, transparency, and informed governance across the Optimism Collective, empowering stakeholders to make astute, data-driven decisions."", 'website': 'https://optimism.curiahub.xyz/'}, 'reviewer': {'userFID': '18391', 'ethAddress': '0x7fc80fad32ec41fd5cfcc14eee9c31953b6b4a8b'}, 'context': {'ecosystems': [{'name': 'Optimism', 'tags': [{'category': 'Governance', 'subcategory': 'Infra & Tooling', 'round': 'RF6'}]}], 'userInterface': 'Impact Garden'}, 'contributions': [{'name': 'Curia OP Governance Analytics Dashboard', 'description': 'Curia OP Governance Analytics Dashboard', 'website': 'https://optimism.curiahub.xyz/'}], 'impactAttestations': [{'name': 'Likely to Recommend', 'type': 'numeric', 'value': 10}, {'name': 'Feeling if didnt exist', 'type': 'numeric', 'value': 3}, {'name': 'Governance Knowledge', 'type': 'numeric', 'value': ''}, {'name': 'Useful for Understanding', 'type': 'numeric', 'value': ''}, {'name': 'Effective for Improvements', 'type': 'numeric', 'value': ''}, {'name': 'Why Effective for Improvements', 'type': 'string', 'value': ''}, {'name': 'Text Review', 'type': 'string', 'value': 'I use Curia frequently because it includes advanced delegation information and its graphs are very user-friendly. It helps me see how the amount delegated to me has changed over time.'}]}",OK
322,0xa81d3c921581de682dec599f80017f52075e15364b101f1e5c2a98ea6657ec45,0x7484aABFef9f39464F332e632047983b67571C0a,0xEB40A065854bd90126A4E697aeA0976BA51b2eE7,2024-10-18 12:07:34,0xcce5500b020a4efe92eed7cec0e465f75a651f8fd6098b5adf5d0a01204f01c9,0x8d1971ff2cf36055f986399fc91bff2d3bf815d2cff4f169f154fc70035fc193,4469,MGL,https://gateway.pinata.cloud/ipfs/QmPbCJVLvV36uvRKqSwH3tnZrmMcLuEPKDmedQWnDTQqZF,"{'id': 2126, 'project': {'name': 'ETH Daily', 'description': 'ETH Daily is an Ethereum news aggregator. It covers the latest on Ethereum and the Layer 2 rollup ecosystem, like the Superchain. ETH Daily has delivered over 500 news briefings in audio and text form, now available onchain with Pods on Base.', 'website': 'https://pods.media/ethdaily'}, 'reviewer': {'userFID': 4469, 'ethAddress': '0x8dd75bcf926df8f50be9bd6532628e9b071bd2c9'}, 'context': {'ecosystems': [{'name': 'Optimism', 'tags': [{'category': 'Governance', 'subcategory': 'Infra & Tooling', 'round': 'RF6'}]}], 'userInterface': 'Impact Garden'}, 'contributions': [{'name': 'ETH Daily', 'description': 'ETH Daily', 'website': 'https://pods.media/ethdaily'}], 'impactAttestations': [{'name': 'Likely to Recommend', 'type': 'numeric', 'value': 10}, {'name': 'Feeling if didnt exist', 'type': 'numeric', 'value': 3}, {'name': 'Governance Knowledge', 'type': 'numeric', 'value': ''}, {'name': 'Useful for Understanding', 'type': 'numeric', 'value': ''}, {'name': 'Effective for Improvements', 'type': 'numeric', 'value': ''}, {'name': 'Why Effective for Improvements', 'type': 'string', 'value': ''}, {'name': 'Text Review', 'type': 'string', 'value': ''}]}",farcaster_not_gov_participant
323,0xa88c624cb6244d6720c4327b173eea5f9ea83d7e80768f3409acc01dc2610c7a,0x7484aABFef9f39464F332e632047983b67571C0a,0x07Fda67513EC0897866098a11dC3858089D4A505,2024-10-17 14:36:55,0xbe6777eb0f4b0a3028a889d55ff0e62402e4e5e77c197648c673f25380e076ca,0x6b68c75e9dcd10c64f2b440e47589eb9ef29e17352055816e4f974401eab2358,17229,MGL,https://gateway.pinata.cloud/ipfs/QmReAbcCSTDgrfitDyGHBqxoQWuykH1prtCwPXFBANhsX2,"{'id': 2030, 'project': {'name': 'Curia OP Governance Analytics Dashboard', 'description': ""We are the team behind the Curia OP Governance Analytics Dashboard, a comprehensive tool designed to empower the Optimism Collective through transparency and data-driven insights. Our dashboard provides essential governance metrics such as participation rates, voting power distribution, delegates' performance, and voting history. By continuously refining our features based on community feedback, we've enriched stakeholder engagement and informed decision-making processes.\n\nSince last year, we've introduced significant enhancements to the dashboard, including:\n\nCitizen House Integration: We now provide comprehensive data visualization tools for the Citizen House, focusing on Badgeholder analytics and veto proposals. This update enables a clearer understanding of activities within the Citizen House and enhances transparency around proposal results and participation.\n\nRetroPGF Project Analytics: Our dashboard now offers detailed tracking and insights into RetroPGF projects, including an Application Funnel Overview that displays the entire project application process, from submission to decision. We also provide analytics on ongoing and upcoming RetroPGF projects, including RetroPGF 3 & 4, ensuring that the community can better understand and monitor project dynamics and impact.\n\nUI and User Experience Improvements: We revamped the user interface, enhancing the visibility of delegate voting power and improving the navigation bar for easier interaction. Our new delegate card feature allows for more detailed and interactive insights, making it easier for users to track individual delegate activity.\n\nPartial Delegation Integration: We introduced detailed insights into the sources of a delegate's voting power, distinguishing between partial and full delegations. This feature provides a more granular view of each delegate’s influence within the governance process.\n\nDelegate Ranking Bump Chart: A dynamic tool that visualizes the evolution of delegates’ voting power over various timeframes, offering a detailed view of ranking changes to better understand the governance dynamics.\n\nThrough these updates, the Curia OP Governance Analytics Dashboard has continued to foster a culture of accountability, transparency, and informed governance across the Optimism Collective, empowering stakeholders to make astute, data-driven decisions."", 'website': 'https://optimism.curiahub.xyz/'}, 'reviewer': {'userFID': 17229, 'ethAddress': '0xdcf7be2ff93e1a7671724598b1526f3a33b1ec25'}, 'context': {'ecosystems': [{'name': 'Optimism', 'tags': [{'category': 'Governance', 'subcategory': 'Infra & Tooling', 'round': 'RF6'}]}], 'userInterface': 'Impact Garden'}, 'contributions': [{'name': 'Curia OP Governance Analytics Dashboard', 'description': 'Curia OP Governance Analytics Dashboard', 'website': 'https://optimism.curiahub.xyz/'}], 'impactAttestations': [{'name': 'Likely to Recommend', 'type': 'numeric', 'value': 8}, {'name': 'Feeling if didnt exist', 'type': 'numeric', 'value': 2}, {'name': 'Governance Knowledge', 'type': 'numeric', 'value': ''}, {'name': 'Useful for Understanding', 'type': 'numeric', 'value': ''}, {'name': 'Effective for Improvements', 'type': 'numeric', 'value': ''}, {'name': 'Why Effective for Improvements', 'type': 'string', 'value': ''}, {'name': 'Text Review', 'type': 'string', 'value': 'I have used it many times. Upset as we can go back to a dune dashboard but still a very usefull tool.'}]}",OK
324,0xa9775d5573f204c6ac89943f3d209e219afce6f352ebf2d40f5a8210e007d4d5,0x7484aABFef9f39464F332e632047983b67571C0a,0xf01Dd015Bc442d872275A79b9caE84A6ff9B2A27,2024-10-17 05:54:26,0xbf24079801bd761ca016dc0d1b4d744a07630cff8dd6359b594c885b38b42405,0xaa4cf223915387f8e0cd66640f86f4f770d0c1edfc4303ce1d596a735747e673,384391,MGL,https://gateway.pinata.cloud/ipfs/QmPe8jahm3YqfbmCcLcs8KTa97UTJUFRJNhwqgpdxJE5LE,"{'id': 2193, 'project': {'name': 'Farcaster Attestation', 'description': 'Farcaster Attestation is bringing Farcaster wallet verification on-chain to the Optimism Mainnet. Traditionally, Farcaster wallet verification data is only accessible through the Farcaster Hub, which cannot be utilized directly on Optimism Mainnet via Solidity smart contracts. This creates a centralization issue in the Retro Funding EAS schema, limiting the authorized attester to a single wallet, as it requires verification from a centralized backend.\n\nFarcaster Attestation resolves this centralization problem by enabling anyone to attest their Farcaster data permissionlessly.\n\nWe have replicated the Retro Funding Project and Metadata Schema to test the integration with Farcaster Attestation. For more information, refer to the Links section.', 'website': ''}, 'reviewer': {'userFID': '384391', 'ethAddress': '0xad4f365a550835d40dc2e95fdffa1e4edd3fbe14'}, 'context': {'ecosystems': [{'name': 'Optimism', 'tags': [{'category': 'Governance', 'subcategory': 'Infra & Tooling', 'round': 'RF6'}]}], 'userInterface': 'Impact Garden'}, 'contributions': [{'name': 'Farcaster Attestation', 'description': 'Farcaster Attestation', 'website': ''}], 'impactAttestations': [{'name': 'Likely to Recommend', 'type': 'numeric', 'value': 8}, {'name': 'Feeling if didnt exist', 'type': 'numeric', 'value': 1}, {'name': 'Governance Knowledge', 'type': 'numeric', 'value': ''}, {'name': 'Useful for Understanding', 'type': 'numeric', 'value': ''}, {'name': 'Effective for Improvements', 'type': 'numeric', 'value': ''}, {'name': 'Why Effective for Improvements', 'type': 'string', 'value': ''}, {'name': 'Text Review', 'type': 'string', 'value': ''}]}",OK
325,0xaeac025d0c3d8e9f77809c24c4a7838b3537d1c305cebcf80c9b03df1da2cb9e,0x7484aABFef9f39464F332e632047983b67571C0a,0x07Fda67513EC0897866098a11dC3858089D4A505,2024-10-17 05:55:30,0xbe6777eb0f4b0a3028a889d55ff0e62402e4e5e77c197648c673f25380e076ca,0x6b68c75e9dcd10c64f2b440e47589eb9ef29e17352055816e4f974401eab2358,384391,MGL,https://gateway.pinata.cloud/ipfs/QmW6jkVe3dznXrNLjbTYjuMUJzyxEN6UJEJ2Di7aaefLdH,"{'id': 2030, 'project': {'name': 'Curia OP Governance Analytics Dashboard', 'description': ""We are the team behind the Curia OP Governance Analytics Dashboard, a comprehensive tool designed to empower the Optimism Collective through transparency and data-driven insights. Our dashboard provides essential governance metrics such as participation rates, voting power distribution, delegates' performance, and voting history. By continuously refining our features based on community feedback, we've enriched stakeholder engagement and informed decision-making processes.\n\nSince last year, we've introduced significant enhancements to the dashboard, including:\n\nCitizen House Integration: We now provide comprehensive data visualization tools for the Citizen House, focusing on Badgeholder analytics and veto proposals. This update enables a clearer understanding of activities within the Citizen House and enhances transparency around proposal results and participation.\n\nRetroPGF Project Analytics: Our dashboard now offers detailed tracking and insights into RetroPGF projects, including an Application Funnel Overview that displays the entire project application process, from submission to decision. We also provide analytics on ongoing and upcoming RetroPGF projects, including RetroPGF 3 & 4, ensuring that the community can better understand and monitor project dynamics and impact.\n\nUI and User Experience Improvements: We revamped the user interface, enhancing the visibility of delegate voting power and improving the navigation bar for easier interaction. Our new delegate card feature allows for more detailed and interactive insights, making it easier for users to track individual delegate activity.\n\nPartial Delegation Integration: We introduced detailed insights into the sources of a delegate's voting power, distinguishing between partial and full delegations. This feature provides a more granular view of each delegate’s influence within the governance process.\n\nDelegate Ranking Bump Chart: A dynamic tool that visualizes the evolution of delegates’ voting power over various timeframes, offering a detailed view of ranking changes to better understand the governance dynamics.\n\nThrough these updates, the Curia OP Governance Analytics Dashboard has continued to foster a culture of accountability, transparency, and informed governance across the Optimism Collective, empowering stakeholders to make astute, data-driven decisions."", 'website': 'https://optimism.curiahub.xyz/'}, 'reviewer': {'userFID': '384391', 'ethAddress': '0xad4f365a550835d40dc2e95fdffa1e4edd3fbe14'}, 'context': {'ecosystems': [{'name': 'Optimism', 'tags': [{'category': 'Governance', 'subcategory': 'Infra & Tooling', 'round': 'RF6'}]}], 'userInterface': 'Impact Garden'}, 'contributions': [{'name': 'Curia OP Governance Analytics Dashboard', 'description': 'Curia OP Governance Analytics Dashboard', 'website': 'https://optimism.curiahub.xyz/'}], 'impactAttestations': [{'name': 'Likely to Recommend', 'type': 'numeric', 'value': 9}, {'name': 'Feeling if didnt exist', 'type': 'numeric', 'value': 1}, {'name': 'Governance Knowledge', 'type': 'numeric', 'value': ''}, {'name': 'Useful for Understanding', 'type': 'numeric', 'value': ''}, {'name': 'Effective for Improvements', 'type': 'numeric', 'value': ''}, {'name': 'Why Effective for Improvements', 'type': 'string', 'value': ''}, {'name': 'Text Review', 'type': 'string', 'value': ''}]}",OK
326,0xb210bd854e7f47b11806e9acb15954d1ecc91119daf3af6214fd47df5e2d4107,0x7484aABFef9f39464F332e632047983b67571C0a,0xEdD95782d13902Ae535332b5D233041E47aD69E6,2024-10-18 12:05:09,0x00857080059ebdd4f252fc921094498fc4025959df7d48785482790385b0e6f3,0xbb1e4aadda991e93d4ba4630582f222b2c57c0b0d729e29247cf2a3873936808,4469,MGL,https://gateway.pinata.cloud/ipfs/Qmc8c7kePdZYHUNTzNdpdFEQET56AHdjJ1AKdN52VttE6u,"{'id': 1789, 'project': {'name': 'Tribuni Telegram Bot', 'description': ""Delegates are the cornerstone of Optimism's governance system. Active and well-informed delegates lead to resilient and sound governance. However, delegates need to process a lot of information, and often find it challenging to stay up-to-date. We are humans after all.\\n\\nTo help delegates stay active and well-informed, my team launched Tribuni - a free telegram mini-app built for delegates. Tribuni sends you quality AI proposal summaries, vote reminders and OP forum activity digest via Telegram. Delegates never miss a vote or an important discussion in OP ecosystem as long as they're on Telegram.\\n\\nAs of Sep 2024, Tribuni supports people managing 28 OP delegate profiles with ~28M vote power combined. Tribuni has become an indispensable part of their delegate workflow. "", 'website': 'https://tribuni.vercel.app/'}, 'reviewer': {'userFID': 4469, 'ethAddress': '0x8dd75bcf926df8f50be9bd6532628e9b071bd2c9'}, 'context': {'ecosystems': [{'name': 'Optimism', 'tags': [{'category': 'Governance', 'subcategory': 'Infra & Tooling', 'round': 'RF6'}]}], 'userInterface': 'Impact Garden'}, 'contributions': [{'name': 'Tribuni Telegram Bot', 'description': 'Tribuni Telegram Bot', 'website': 'https://tribuni.vercel.app/'}], 'impactAttestations': [{'name': 'Likely to Recommend', 'type': 'numeric', 'value': 10}, {'name': 'Feeling if didnt exist', 'type': 'numeric', 'value': 3}, {'name': 'Governance Knowledge', 'type': 'numeric', 'value': ''}, {'name': 'Useful for Understanding', 'type': 'numeric', 'value': ''}, {'name': 'Effective for Improvements', 'type': 'numeric', 'value': ''}, {'name': 'Why Effective for Improvements', 'type': 'string', 'value': ''}, {'name': 'Text Review', 'type': 'string', 'value': ''}]}",farcaster_not_gov_participant
327,0xb4b8fa8b5cf02a7f553dc915c0d9927df9257b682ac0812bb86520958c4aeacd,0x7484aABFef9f39464F332e632047983b67571C0a,0x9934465Ee73BeAF148b1b3Ff232C8cD86c4c2c63,2024-10-17 10:45:10,0x71ab640641b9c11726f5ad4f492ef9a8923a5ed16405588990c530c42956e0cc,0xfb52bbc12284743f2bf1ad88e2b1b5b3b08d88fa1a7414eefd256ee2ad4e6c73,195722,MGL,https://gateway.pinata.cloud/ipfs/QmVCSCMSURzB4DNsYGsMwUtqXXDWtFhFGr9fgsxTmVXfUu,"{'id': 1925, 'project': {'name': 'Retro Funding Application Review', 'description': ""The platform for facilitating Retro Funding Round 4 & 5's application review process prior to badgeholder votes. "", 'website': 'https://www.charmverse.io/'}, 'reviewer': {'userFID': 195722, 'ethAddress': '0xe422d6c46a69e989ba6468ccd0435cb0c5c243e3'}, 'context': {'ecosystems': [{'name': 'Optimism', 'tags': [{'category': 'Governance', 'subcategory': 'Infra & Tooling', 'round': 'RF6'}]}], 'userInterface': 'Impact Garden'}, 'contributions': [{'name': 'Retro Funding Application Review', 'description': 'Retro Funding Application Review', 'website': 'https://www.charmverse.io/'}], 'impactAttestations': [{'name': 'Likely to Recommend', 'type': 'numeric', 'value': 3}, {'name': 'Feeling if didnt exist', 'type': 'numeric', 'value': 1}, {'name': 'Governance Knowledge', 'type': 'numeric', 'value': ''}, {'name': 'Useful for Understanding', 'type': 'numeric', 'value': ''}, {'name': 'Effective for Improvements', 'type': 'numeric', 'value': ''}, {'name': 'Why Effective for Improvements', 'type': 'string', 'value': ''}, {'name': 'Text Review', 'type': 'string', 'value': 'Charmverse does help manage the flow, and comments work well, but the form based view is unhandy. Data integrity issues are a big risk with the current setup.'}]}",OK
328,0xb8a51ac422d9073a354d871405a8a64b8474bb1d5b37ce7b458ad95707a209e2,0x7484aABFef9f39464F332e632047983b67571C0a,0x3EF1b0db4D10d2e3cE06699C0BD4EF0aAf897614,2024-10-16 22:26:09,0xb106bf42180e5dac3dd47cacee5626f2922021420311346f0949e3243a6af6b0,0x98877a3c5f3d5eee496386ae93a23b17f0f51b70b3041b3c8226f98fbeca09ec,318387,MGL,https://gateway.pinata.cloud/ipfs/QmNjqUHjH53r7w3RMkWceFE2sRCBJSWsztwui5oiLZM4f9,"{'id': 1828, 'project': {'name': 'Pairwise', 'description': 'Pairwise was designed to make voting to distribute Retro Funding simple and fun. Pairwise is an open-source, off-chain voting dapp (like Snapshot) that streamlines community signaling by letting users select between just two options and then aggregating their choices into a quantifiable result.\nPairwise is designed to be user-friendly and intuitive, allowing users to make many simple choices and then the algorithm behind the scenes pumps out a final ranking for them to adjust or approve. \n\n* RF3: Served as an alternative tool for creating lists and subcategories of 600+ projects.\n* RF4: Ran its own independent experiment involving all stakeholders to signal how to distribute RF promoting project discovery with pseudonymous voting.\n* RF5: After great work on RF4, was invited to be a fun voting option to gamify and simplify the badgeholder decision making process. Allowing Badgeholders to create their ballot by comparing projects.', 'website': 'https://www.pairwise.vote/'}, 'reviewer': {'userFID': 318387, 'ethAddress': '0x0000000000000000000000000000000000000000'}, 'context': {'ecosystems': [{'name': 'Optimism', 'tags': [{'category': 'Governance', 'subcategory': 'Infra & Tooling', 'round': 'RF6'}]}], 'userInterface': 'Impact Garden'}, 'contributions': [{'name': 'Pairwise', 'description': 'Pairwise', 'website': 'https://www.pairwise.vote/'}], 'impactAttestations': [{'name': 'Likely to Recommend', 'type': 'numeric', 'value': 8}, {'name': 'Feeling if didnt exist', 'type': 'numeric', 'value': 2}, {'name': 'Governance Knowledge', 'type': 'numeric', 'value': ''}, {'name': 'Useful for Understanding', 'type': 'numeric', 'value': ''}, {'name': 'Effective for Improvements', 'type': 'numeric', 'value': ''}, {'name': 'Why Effective for Improvements', 'type': 'string', 'value': ''}, {'name': 'Text Review', 'type': 'string', 'value': ''}]}",OK
329,0xbab8a91881390e4600dbc9ac26b133c79f70231d3da06bec0bc8f6c3b79194ca,0x7484aABFef9f39464F332e632047983b67571C0a,0x40a0D0a2e36FBECc22447Db34C997aF3b336c7B4,2024-10-17 00:43:40,0x28415244574191f56aae9b13bf81d37ca40bc7db2b0201903d60f280330e2653,0x8baac027df9c78c3dbda664c8f0190391e6b4bdabf240da9ccc4f0837933d8f2,384391,MGL,https://gateway.pinata.cloud/ipfs/QmVdk9mFDKxZ7BoYpSK5joDFq9XL4ytdfaW9utvCY3H8ky,"{'id': 1782, 'project': {'name': 'Metrics Garden Labs', 'description': ""We're an Impact Studio focused in advancing Impact Assessment in the web3 space through research, experiments, and mechanism design. "", 'website': 'https://www.metricsgarden.xyz'}, 'reviewer': {'userFID': '384391', 'ethAddress': '0xad4f365a550835d40dc2e95fdffa1e4edd3fbe14'}, 'context': {'ecosystems': [{'name': 'Optimism', 'tags': [{'category': 'Governance', 'subcategory': 'Infra & Tooling', 'round': 'RF6'}]}], 'userInterface': 'Impact Garden'}, 'contributions': [{'name': 'Metrics Garden Labs', 'description': 'Impact Garden', 'website': 'https://www.metricsgarden.xyz'}], 'impactAttestations': [{'name': 'Likely to Recommend', 'type': 'numeric', 'value': 9}, {'name': 'Feeling if didnt exist', 'type': 'numeric', 'value': 3}, {'name': 'Governance Knowledge', 'type': 'numeric', 'value': ''}, {'name': 'Useful for Understanding', 'type': 'numeric', 'value': ''}, {'name': 'Effective for Improvements', 'type': 'numeric', 'value': ''}, {'name': 'Why Effective for Improvements', 'type': 'string', 'value': ''}, {'name': 'Text Review', 'type': 'string', 'value': 'Perfecto! will be used to generate metrics for Badgeholders to vote on and see impact from another projects'}]}",unknown_project
330,0xbb1278caebed9c5ac041cb1fb84a8ffd916795ca235f276e8911122c0e442396,0x7484aABFef9f39464F332e632047983b67571C0a,0xA7860E99e3ce0752D1ac53b974E309fFf80277C6,2024-10-18 12:07:02,0x4c5822eb6c284edefe4ee6d802f9a5a5d62d93909d60cf33a89b03a9f0bcd49e,0x4a4f522807b32a1e1362a37c868d107f63407947d4efdc4e9ecc94c0fa77db0c,4469,MGL,https://gateway.pinata.cloud/ipfs/Qmb7q7u21sbZ1Bjjc4bpvrWavxzhQZtuxXgHa9TzNP7WW3,"{'id': 2173, 'project': {'name': 'GovScore', 'description': 'GovScore is a platform for discovering quality underrepresented Optimism delegates via a score using onchain data. The factors that determine GovScore are voting history (with and without reason), voting power, and decentralized identity.', 'website': 'https://opgovscore.com/delegates'}, 'reviewer': {'userFID': 4469, 'ethAddress': '0x8dd75bcf926df8f50be9bd6532628e9b071bd2c9'}, 'context': {'ecosystems': [{'name': 'Optimism', 'tags': [{'category': 'Governance', 'subcategory': 'Infra & Tooling', 'round': 'RF6'}]}], 'userInterface': 'Impact Garden'}, 'contributions': [{'name': 'GovScore', 'description': 'GovScore', 'website': 'https://opgovscore.com/delegates'}], 'impactAttestations': [{'name': 'Likely to Recommend', 'type': 'numeric', 'value': 10}, {'name': 'Feeling if didnt exist', 'type': 'numeric', 'value': 3}, {'name': 'Governance Knowledge', 'type': 'numeric', 'value': ''}, {'name': 'Useful for Understanding', 'type': 'numeric', 'value': ''}, {'name': 'Effective for Improvements', 'type': 'numeric', 'value': ''}, {'name': 'Why Effective for Improvements', 'type': 'string', 'value': ''}, {'name': 'Text Review', 'type': 'string', 'value': ''}]}",farcaster_not_gov_participant
